<?xml version="1.0" encoding="UTF-8"?>
<access 
	xmlns="http://www.joomla.org/access" 
	xmlns:xsi="http://www.w3.org/2001/XMLSchema-instance" 
	xsi:schemaLocation="http://www.joomla.org/access access.xsd"
	component="com_helloworld">
	<section name="component">
		<action name="core.admin" 		title="JACTION_ADMIN" 		description="JACTION_ADMIN_COMPONENT_DESC"/>
		<action name="core.manage" 		title="JACTION_MANAGE" 		description="JACTION_MANAGE_COMPONENT_DESC"/>
		<action name="core.create" 		title="JACTION_CREATE" 		description="JACTION_CREATE_COMPONENT_DESC"/>
		<action name="core.delete" 		title="JACTION_DELETE" 		description="JACTION_DELETE_COMPONENT_DESC"/>
		<action name="core.edit" 		title="JACTION_EDIT" 		description="JACTION_EDIT_COMPONENT_DESC"/>
		<action name="core.edit.own"	title="JACTION_EDIT_OWN" 	description="JACTION_EDIT_OWN_COMPONENT_DESC"/>
		<action name="core.edit.state" 	title="JACTION_EDIT_STATE" 	description="JACTION_EDIT_STATE_COMPONENT_DESC"/>
	</section>
	<section name="category">
		<action name="core.create" 		title="JACTION_CREATE" 		description="COM_CATEGORY_ACCESS_CREATE_DESC"/>
		<action name="core.delete" 		title="JACTION_DELETE" 		description="COM_CATEGORY_ACCESS_DELETE_DESC"/>
		<action name="core.edit" 		title="JACTION_EDIT" 		description="COM_CATEGORY_ACCESS_EDIT_DESC"/>
		<action name="core.edit.state" 	title="JACTION_EDIT_STATE" 	description="COM_CATEGORY_ACCESS_EDITSTATE_DESC"/>
	</section>
</access>